{
  "schema": "conf.program/v1",
  "event": {
    "title": "III Молодёжная школа-семинар «Современные методы радиозондирования»",
    "date_from": "2026-11-12",
    "date_to": "2026-11-13",
    "city": "Йошкар-Ола",
    "venue": "ПГТУ, корпус 1",
    "regulations": { "talk_min": 12, "plenary_min": 40, "break_min": 20, "lunch_min": 60 },
    "jury": { "criteria": ["Актуальность", "Новизна", "Качество презентации"], "scale_max": 10 }
  },
  "sections": [
    { "no": 1, "title": "Ионосфера" },
    { "no": 2, "title": "Тропосфера и атмосфера" }
  ],
  "days": [
    { "date": "2026-11-12", "sessions": [
      { "title": "Открытие и пленарная лекция", "room": "ауд. 403", "start": "10:00", "items": [
        { "type": "ceremony", "title": "Открытие школы", "duration": 15 },
        { "type": "plenary", "title": "Ионосферные каналы связи: что нового", "speaker": "Н. В. Рябова, профессор", "org": "ПГТУ" },
        { "type": "break", "title": "Кофе-брейк" }
      ] },
      { "title": "Секция 1. Ионосфера", "room": "ауд. 403", "chair": "К. Г. Ратовский, к.ф.-м.н.", "items": [
        { "type": "talk", "section": 1, "title": "Сезонные вариации критической частоты", "authors": ["А. А. Белов", "Б. Б. Гусева"], "speaker": "Б. Б. Гусева", "org": "ИСЗФ СО РАН", "city": "Иркутск" },
        { "type": "talk", "section": 1, "title": "Модель слоя F2 по данным ионозондов", "authors": ["В. В. Ильин"], "speaker": "В. В. Ильин", "org": "ПГТУ", "city": "Йошкар-Ола" },
        { "type": "talk", "section": 1, "title": "Наклонное зондирование на трассе Йошкар-Ола — Иркутск", "authors": ["Г. Г. Конев", "Д. Д. Лаптев"], "speaker": "Г. Г. Конев", "org": "ПГТУ", "city": "Йошкар-Ола", "format": "online" },
        { "type": "talk", "section": 1, "title": "Перемещающиеся ионосферные возмущения", "authors": ["Е. Е. Мухина"], "speaker": "Е. Е. Мухина", "org": "ИЗМИРАН", "city": "Москва" },
        { "type": "lunch", "title": "Обед" }
      ] },
      { "title": "Секция 2. Тропосфера и атмосфера", "room": "ауд. 406", "start": "14:30", "chair": "Е. В. Федосеева, д.т.н.", "items": [
        { "type": "talk", "section": 2, "title": "Радиометрия влажности атмосферы", "authors": ["Ж. Ж. Носов"], "speaker": "Ж. Ж. Носов", "org": "МИВлГУ", "city": "Муром" },
        { "type": "talk", "section": 2, "title": "Ослабление миллиметровых волн в дожде", "authors": ["З. З. Орлова", "И. И. Петров"], "speaker": "И. И. Петров", "org": "НИРФИ", "city": "Нижний Новгород", "format": "online" },
        { "type": "talk", "section": 2, "title": "Рефракция в приземном слое", "authors": ["К. К. Рыбин"], "speaker": "К. К. Рыбин", "org": "ПГТУ", "city": "Йошкар-Ола" }
      ] },
      { "title": "Стендовая сессия молодых учёных", "room": "фойе 4 этажа", "start": "16:30", "items": [
        { "type": "activity", "title": "Стендовая сессия молодых учёных", "duration": 60 }
      ] }
    ] },
    { "date": "2026-11-13", "sessions": [
      { "title": "Второй день", "room": "ауд. 403", "start": "10:00", "items": [
        { "type": "activity", "title": "Круглый стол «Карьера в радиофизике»", "speaker": "Д. В. Иванов", "duration": 90 },
        { "type": "ceremony", "title": "Подведение итогов и закрытие школы", "start": "11:45", "duration": 30 }
      ] }
    ] }
  ]
}
